,Game,Platform,Content_Descriptor,Interactive_Elements,Ratings_Summary
166,Aggelos,Nintendo Switch,Mild Fantasy Violence,No Interactive Elements,"This is an action platformer in which players use elemental powers to battle evil beings from another dimension. From a side-scrolling perspective, players traverse platforms while using swords and magical projectiles (e.g., fireballs, blasts of energy) to defeat monsters and boss creatures. Enemies mostly burst into coins when defeated. Boss battles depict more frenetic gameplay, with several projectiles and enemies attacking/crowding the screen."
167,Ocean's Heart,Nintendo Switch,"Alcohol Reference,Mild Fantasy Violence",No Interactive Elements,No Rating Summary
168,The Last of Us Part 1,PlayStation 5,"Blood and Gore,Intense Violence,Sexual Themes,Strong Language,Use of Alcohol",No Interactive Elements,"This is an action game in which players assume the roles of Joel and Ellie, human survivors battling their way through a post-apocalyptic world. From a third-person perspective, players traverse through city ruins and use a variety of weapons (e.g., pistols, rifles, explosives, spiked bats, steel pipes, blades) and melee attacks to fight off infected mutants and other human survivors. Players can also employ stealth kills (e.g., strangulations, pistol executions, stabbing attacks) and engage in extended combat sequences involving close-up camera angles and on-screen prompts. Screams of pain, realistic gunfire, and blood-splatter effects accompany the combat. Several attacks result in decapitation or dismemberment; body parts are depicted in some areas (e.g., chopping blocks). Cutscenes also depict intense acts of violence: a young character dying from gunshot wounds; adult characters executed at point-blank range; enemy characters being interrogated and stabbed in the knee. During the course of the game, a character makes sexual remarks about an adult magazine (e.g., ""Whoa. How the hell would he even walk around with that thing” and “Oh why are these [pages] all stuck together?”). One scene allows the player to decide whether a young character drinks alcohol. The words “f**k,” “sh*t,” and “a*shole” appear in the dialogue."
169,Martian Panic,Nintendo Switch,Fantasy Violence,No Interactive Elements,"This is a first-person shooter in which players attempt to save Earth from a Martian invasion. As players move on rails through cartoony environments (e.g., city streets, farms, diners), they use pistols, shotguns, and laser blasters to shoot enemies (e.g., Martians, UFOs, drones). Combat can be frenetic, highlighted by frequent gunfire, laser/blaster sounds, and explosions. Human civilians are often depicted fleeing and screaming, and can be accidentally shot by players, resulting in skull and crossbones floating up into the sky."
170,Slaycation Paradise,"PlayStation 4, PlayStation 5, Stadia, Nintendo Switch, Xbox One, Xbox Series","Blood and Gore,Strong Language,Suggestive Themes,Violence",No Interactive Elements,"This is a shooter game, with tower-defense elements, in which players help a man on vacation survive his dimensional travels. From a top-down perspective, players fight for survival using pistols, machine guns, and shotguns to kill hordes of creatures (e.g., demons, living sex-dolls, mutated luchadores). Players also build turrets and barricades to fend off waves of enemies. Battles are frenetic, accompanied by realistic gunfire, explosions, and large blood-splatter effects. Some weapon attacks cause enemies to explode into pieces, causing entrails to hit players' screen. The game contains some suggestive/sexual material: dialogue stating “…you rubbed nubs with that crap sack Lorik” and “This is where we…measure our proverbial members against each other”; a level with red-light district signs reading “XXX,” “Fish & Chips + Naked Chicks”; a neon sign with the words “Now Open” between spread-open legs. The words “f**k” and “sh*t” appear in the game."
171,Horse Club Adventure 2: Hazelwood Stories,"PlayStation 4, PlayStation 5, Nintendo Switch",No Descriptors,No Interactive Elements,"This is a horse-riding simulation game in which players return for an autumn vacation at a seaside village. Players interact with friends as they complete missions and activities (e.g., dressage, horse jumping, racing) to earn rewards and items."
172,Rollerdrome,"Windows PC, PlayStation 4, PlayStation 5","Blood,Strong Language,Violence",No Interactive Elements,"This is sports-action shooter in which players assume the role of a competitor in a futuristic death sport called Rollerdrome. From a third-person perspective, players roller skate within enclosed arenas, perform tricks, and use pistols, shotguns, and grenade launchers to attack enemies. Players must kill a set number of human enemies and/or mechanized robots within a time limit. Battles are often frenetic, accompanied by explosions, slow-motion effects, and cries of pain. Blood splatter effects are also depicted as characters are hit/injured. The word “f**k” appears in the game."
173,Flippin Misfits,Windows PC,Fantasy Violence,No Interactive Elements,"This is an action game in which players engage in multiplayer brawls using a gang of young space travelers called Misfits. From a third-person perspective, players use bat-like melee weapons to strike opponents during fast-paced fights. Brawls are highlighted by gravity effects and bodies that get tossed around (i.e., ragdoll physics) when defeated."
174,Maquette,"Nintendo Switch, Xbox One, Xbox Series","Alcohol Reference,Lyrics",No Interactive Elements,"This is a puzzle game in which players manipulate environments while following a modern-day love story. From a first-person perspective, players explore everyday problems in a relationship and use a variety of objects to reach new areas. Some of the conversations involving a couple mention alcohol (e.g., ""Oh, good you got beer""; ""...in a public park drinking wine""; ""...I was too drunk at that New Year's party.""). Accompanying song lyrics contain allusions and references to controlled substances and/or drugs (e.g., “There's no remedy/But the drugs help till I'm ready”; “World war one brand smokes/lit with rolled matches...""; “We'll drink until our brains black out”)."
175,Hidden Objects Collection Volume 4,Nintendo Switch,"Alcohol Reference,Mild Language,Use of Tobacco",No Interactive Elements,No Rating Summary
176,CRISIS CORE -FINAL FANTASY VII- REUNION,"Windows PC, PlayStation 4, PlayStation 5, Nintendo Switch, Xbox One, Xbox Series","Blood,Violence",No Interactive Elements,"This is an action/role-playing game in which players follow the adventures of Zack Fair, a special forces member trying to uncover a plot and save a fantastical world. From a third-person perspective, players explore various environments and towns while battling enemies in melee and occasional ranged combat. Players use oversized swords and, during one mission, sniper rifles to kill enemy guards and fantastical creatures (e.g., fire monsters, ghouls, demons). One sequence depicts a character attacked by soldiers; a cutscene depicting the aftermath shows corpses laying in pools of blood and with blood splattered on faces, clothing, and weapons. A handful of other cutscenes depict characters impaled by swords."
177,Outbreak Contagious Memories,"PlayStation 4, PlayStation 5, Nintendo Switch","Blood and Gore,Intense Violence,Strong Language",No Interactive Elements,No Rating Summary
178,Hooked on You: A Dead by Daylight Dating Sim™,Windows PC,"Blood,Language,Suggestive Themes,Use of Alcohol,Violent References",No Interactive Elements,"This is a visual novel in which players try to regain their memories while romancing four killers. As players follow the story, they make dialogue choices and engage in mini-games that influence the outcome of events. Some scenes contain violent themes and/or detailed descriptions of violent acts (e.g., “I threatened to kill every single person on this island”; “There, in…the box, was a pile of…pieces. Like parts of doll, almost, pulled apart…”; “A collection of segments, limbs, pieces….Clearly severed and placed in a neat little pile”; ""Can I kill them or not?”). Characters are sometimes depicted with bloodstained hands, weapons, or clothing; one gallery image depicts a character with a bloody wound on their chest. Some female characters wear revealing outfits (e.g., low-cut bikinis, large amounts of cleavage); the dialogue also contains some suggestive material (e.g., “This ain't a peep show...All make-outs will happen out of view of the public eye”; ""...[N]o one will ever be quite as interesting to make love to as a vampire…”). One sequence allows players' character to order from a list of alcoholic drinks; a mini-game involves characters drinking shots of alcohol. The words “sh*t” and “p*ssy” appear in the game."
179,Inscryption,"PlayStation 4, PlayStation 5, Nintendo Switch","Blood,Strong Language,Violence",No Interactive Elements,"This is a card-based deck-building game in which players battle a mysterious force while building their card decks, solving puzzles, and overcoming challenges. Gameplay mostly consists of card-based battles in which players attempt to defeat opponents by using animal-themed cards that slash, bite, or divebomb opponents' cards. One cutscene depicts first-person video footage of a man getting shot; the camera falls to the ground as a large blood pool is seen. The word “f**k” appears in the game."
180,King's Bounty 2,PlayStation 5,"Alcohol Reference,Mild Blood,Mild Language,Mild Suggestive Themes,Violence",No Interactive Elements,"This is a role-playing game in which players perform quests and explore worlds while following a non-linear storyline. From a third-person perspective, players move around environments, interact with characters, and engage in combat. Battles against units (e.g., soldiers, monsters, animals) are depicted on hexagonal grid-like battlefields, highlighted by cries of pain, impact/clashing sounds, and brief puffs/clouds of blood. Cutscenes depict further instances of violence: a man stabbing himself; a bound prisoner struck with a blade; another character stabbed in the back. The game contains some suggestive material in the dialogue (e.g., “One pinch, amorous passion.../""...speaking of amorous passion, I'm an assassin not a master of the bedchamber""; ""...[T]hen I'll throw you down in the tall grass and…""/""...Ah, it gets rather personal after that bit.""). In some scenes, characters discuss wine, booze, and drunkards/drunkenness. The words “bastard” and “a*s” appear in dialogue."
181,Little League World Series Baseball 2022,"Windows PC, PlayStation 4, PlayStation 5, Nintendo Switch, Xbox One, Xbox Series",No Descriptors,No Interactive Elements,"This is a baseball simulation game in which players compete with Little League teams to win the Little League World Championship. Players can practice catching, throwing, and pitching, as well as compete in various modes (e.g., Exhibition, Quickplay, Tournament)."
182,Thymesia,"PlayStation 5, Xbox Series","Blood,Violence",No Interactive Elements,"This is an action role-playing game in which players assume the role of a character on a quest to save a kingdom from plague. From a third-person perspective, players explore various locations (e.g., towns, dungeons, ruins), while battling mutant creatures and infected inhabitants. Players use swords and claws to kill enemies in frenetic melee-style combat. Battles are highlighted by impact sounds, cries of pain, and large blood-splatter effects. Players can perform finishing attacks on weakened enemies, often resulting in close-up impaling with blood and slow-motion effects. Some areas depict large blood stains and/or corpses lying in large pools of blood."
183,F1 Manager 2022,"Windows PC, PlayStation 4, PlayStation 5, Xbox One, Xbox Series",Mild Language,No Interactive Elements,"This is a racing simulation game in which players assume the role of a Team Principal for a real-world Formula 1 team. Players can manage the team's facilities, set racing strategies, and race various cars on tracks. Some language in the game is partially censored by audible bleeps (e.g., “For [bleep] sake, man”; “Ah man, that was such [bleep]""; “I am a [bleep] idiot!”)."
184,Tunche,"PlayStation 4, Nintendo Switch","Fantasy Violence,Language",No Interactive Elements,No Rating Summary
185,Pathfinder: Wrath of the Righteous,"PlayStation 4, Xbox One","Blood and Gore,Sexual Themes,Strong Language,Violence",No Interactive Elements,"This is a role-playing game in which players lead adventurers on a quest to stop demons from invading a kingdom. From a 3/4-overhead perspective, players explore the land to gain allies and engage in turn-based combat against human enemies and fantastical creatures (e.g., demons, minotaur, wizards). Players use swords, axes, daggers, and magic attacks to kill enemies in frenetic combat. Some weapon attacks can result in dismemberment and decapitation, with large blood-splatter effects. The game contains some suggestive/sexual material in the dialogue (e.g., “I want to gouge out your eyes and f**k your eyeholes”; “...I need sex. I won't sleep tonight without a man…”; “Now we're going to engage in the act of copulation exclusively for the sake of carnal pleasure.” The words “f**k” and “sh*t” appear in the game."
186,Outbreak Collection Part 1,Nintendo Switch,"Blood,Violence",No Interactive Elements,"This is a collection of three survival-horror games in which players assume the roles of survivors amid a zombie outbreak. Players explore buildings while solving puzzles, searching for supplies, and battling zombies and mutants. Players use pistols, machine guns, shotguns, and bladed weapons to kill enemies. Battles are accompanied by realistic gunfire, large explosions, and frequent blood-splatter effects. Some areas depict large bloodstains in the environment."
187,Card Shark,Nintendo Switch,"Language,Mild Violence,Simulated Gambling,Suggestive Themes,Use of Alcohol and Tobacco",No Interactive Elements,"This is a narrative adventure game in which players assume the role of a boy traveling with a nobleman and con artists to swindle nobles in 18th-century France. As players progress through the narrative, they can interact with characters and learn various card-manipulation techniques (e.g., false shuffles, deck switching, false deals); players sometimes place bets on card games while using the manipulation techniques. Some interactions lead to instances of violence: a woman shot; a man impaled. The game contains brief suggestive references in the dialogue (e.g., “Meaning the experiment quickly turned into a never-ending orgy”; “You will probably die soon, on the gallows or of the pox”/“That will depend on whether I embrace your principles or your mistress.”). During the course of the game, players can repeatedly refill a character's glass with wine; one character is shown smoking a pipe. The word “a*s” appears in the game."
188,Outbreak Collection Part 2,Nintendo Switch,"Blood,Strong Language,Violence",No Interactive Elements,"This is a collection of two survival horror games in which players search for survivors while battling zombies during a viral outbreak. From a third-person perspective, players explore locations, locate survivors, and use weapons (e.g., pistols, machine guns, shotguns, knives) to fight off attacking zombies. Fighting is highlighted by gunfire, explosions, and cries of pain. Large blood-splatter effects occur during battle; large blood stains are depicted on the ground. The words “f**k” and “sh*t” appear in the game."
189,Embers of Mirrim,"PlayStation 4, Nintendo Switch",Mild Fantasy Violence,No Interactive Elements,No Rating Summary
190,Hidden Through Time: Definite Edition,"PlayStation 4, Nintendo Switch","Alcohol Reference,Mild Language",No Interactive Elements,"This is a hidden-object game in which players are tasked with finding specific items amid historical scenes. A handful of locations depict mugs of amber liquid, and one clue also references alcohol (e.g., “I don't know if I'm drunk or not...""). The word “damn” appears in game text."
191,Ooblets,Nintendo Switch,No Descriptors,No Interactive Elements,"This is an adventure game in which players explore, farm, and explore their new home in and around Badgetown. Players can also engage in mini-games (e.g., farming tasks, dance battles) while collecting creatures called Ooblets."
192,Blade Assault,"PlayStation 4, PlayStation 5, Nintendo Switch, Xbox One, Xbox Series","Fantasy Violence,Language,Use of Tobacco",No Interactive Elements,"This is an action platformer in which players assume the role of a resistance fighter battling corrupt military forces in the future. Players traverse 2D side-scrolling environments while battling various enemies (e.g., soldiers, robots, mutant creatures). Players use laser swords, hammers, and blasters against enemies in frenetic melee-style combat.  Battles are highlighted by gunfire, explosions, and screen-shaking effects. The game depicts recurring characters smoking cigarettes and/or cigars. The word “sh*t” appears in the game."
193,Monster Train First Class,Nintendo Switch,"Alcohol Reference,Fantasy Violence,Mild Language",No Interactive Elements,No Rating Summary
194,The Pathless,Nintendo Switch,Fantasy Violence,No Interactive Elements,"This is an action/adventure game in which players assume the role of a master archer trying to dispel a dark curse. As players explore a mysterious island, they forge a bond with an eagle companion, traverse landscapes, solve puzzles, and engage in a handful of boss battles with fantasy creatures (e.g., cursed animal spirits, hydra-like monsters). Boss battles can be frenetic, with players shooting arrows, and enemies spewing fireballs, energy blasts, and lava. Combat is highlighted by impact sounds, cries of pain, and screen-shaking effects."
195,They Bleed Pixels,Nintendo Switch,"Blood and Gore,Violence",No Interactive Elements,No Rating Summary
196,The American Dream,PlayStation 4,"Blood,Sexual Themes,Strong Language,Use of Alcohol,Violence",No Interactive Elements,No Rating Summary
197,Broforce,"PlayStation 4, Nintendo Switch","Blood and Gore,Mild Language,Use of Tobacco,Violence",No Interactive Elements,No Rating Summary
198,Train Life - A Railway Simulator,"Windows PC, PlayStation 4, PlayStation 5, Nintendo Switch, Xbox One, Xbox Series",No Descriptors,No Interactive Elements,"This is a simulation game in which players control the operations of realistic trains. As players travel between stations, they can pick up and deliver various forms of cargo."
199,Pentiment,"Windows PC, Xbox One, Xbox Series","Blood and Gore,Sexual Themes,Strong Language,Violence",No Interactive Elements,"This is a narrative-adventure game in which players assume the role of an illustrator (Andreas) who must uncover the truth behind a series of murders. As players explore a medieval abbey in Germany, they can make dialogue choices that influence the outcome of the narrative. Some choices lead to instances of violence and/or gore: a man using a rifle to shoot villagers; characters decapitated by an executioner; characters strangled to death; a man slicing a deer's throat—these sequences are often accompanied by blood stains/effects. The game contains some sexual material in the dialogue (e.g., “Well, there is a sore on his sex. Probably from the French disease...visiting brothels in Naples”; “Sex and death are common companions…”; “Besides sex isn't all that rare inside the abbey”; “...[T]he baron tried to seduce [her]. He dragged her into the woods…she had been beaten so badly she could hardly move.”). The words “f**k,” “sh*t,” and “a*shole” appear in the game."
200,Deliver Us Mars,Windows PC,"Mild Blood,Violence",No Interactive Elements,"This is an action-adventure game in which players assume the roles of astronauts investigating a lost colony on Mars. From first- and third-person perspectives, players explore spacecrafts and colonies, solve puzzles, and avoid hazards (e.g., electrical bursts). As players progress, they can unlock journal entries depicting holographic images of violence/peril: colonists suffocating to death; characters sucked into space as a result of a terrorist attack. One sequence depicts an exploding space craft, with a woman left on board. Some scenes depict human corpses scattered across facilities, including a man with blood on his face."
201,Autonauts,"PlayStation 4, Nintendo Switch",No Descriptors,No Interactive Elements,"This is a strategy game in which players help establish a colony on a new planet. Players use robots to harvest resources, build structures, and craft objects to expand the colony."
202,Labyrinth of Zangetsu,"PlayStation 4, Nintendo Switch","Animated Blood,Fantasy Violence,Mild Language",No Interactive Elements,"This is an action-adventure game in which players lead characters on a quest to stop a blight across ancient Japan. Players explore dungeon-like environments and battle stylized creatures (e.g., demons, ink-stained creatures, shadows) in turn-based combat. Players choose actions from a menu (e.g., attack, parry, magic) to battle enemies; attacks are accompanied by sword slashes and screen-shaking effects. Characters sometimes emit splashes of black liquid/ink when hit; one hand-drawn sequence depicts black splatters around bodies, and a hand smeared with black liquid. The word “damn” appears in the game."
203,Azure Striker GUNVOLT 3,Nintendo Switch,"Fantasy Violence,Mild Blood,Mild Language,Suggestive Themes",No Interactive Elements,"This is an action-platformer in which players assume the role of a super-powered figure trying to control a threat and defeat a villain. From a side-scrolling perspective, players traverse platforms and engage in fast-paced combat against enemy soldiers and boss characters. Players can also send a dragon character to engage in melee combat. Battles are highlighted by cries of pain, light effects, and explosions. One still image depicts a character impaled by a sword; another image depicts the wounded character with blood on his mouth. Some female characters are designed with revealing outfits (e.g., deep cleavage); the dialogue contains some references to suggestive material (e.g., “sex-obsessed harlot”; “Ugh, pervert”; “…I actually caught a peek as she was changing clothes the other day…”; “Why don't the two of you come with me and we can make some real love?” The words “a*s” and “bastard” appear in dialogue."
204,What Remains of Edith Finch,"PlayStation 5, Xbox Series","Blood,Drug Reference,Language,Violence",No Interactive Elements,No Rating Summary
205,35MM,PlayStation 4,"Blood and Gore,Strong Language,Violence",No Interactive Elements,No Rating Summary
206,Bratz: Flaunt Your Fashion,"Windows PC, PlayStation 4, PlayStation 5, Stadia, Nintendo Switch, Xbox One, Xbox Series",No Descriptors,No Interactive Elements,"This is an adventure game in which players help Bratz characters grow their fanbase as they explore different cites (e.g.,  Seoul, Barcelona). Players engage in photo shoots and earn followers by completing various activities (e.g., skating, yoga, beachside events)."
207,Amnesia: Memories,Nintendo Switch,"Blood,Language,Sexual Themes,Use of Alcohol,Violence",No Interactive Elements,"This is a visual novel in which players follow the story of an amnesiac trying to hide her memory loss while navigating relationships with men. As players follow events between five different paths/worlds, they make various choices, attempting to reach good outcomes. One scene depicts a character with a bloodstained knife protruding from his chest; blood is also seen on his face and clothing. Some still-screen images depict characters (fully clothed) embracing, kissing, and/or restraining players' character, sometimes with suggestive dialogue (e.g., “I'll show you a good time...How does 20,000 yen sound”; “If you don't resist, I won't know when to stop”; “I won't do anything...If you really can't trust me, I'll bring something for you to tie up my hands”; “Is 2 guys at once alright?”). During two prolonged sequences, a main character is depicted drunk (e.g., ""I think this guy's had just a little too much to drink""; ""I'm still a little drunk""; ""You're drinking more alcohol? You're still drinking?"").  The word “sh*t” appears in game text."
208,Aztech Forgotten Gods,"PlayStation 5, Nintendo Switch","Language,Mild Blood,Violence",No Interactive Elements,No Rating Summary
209,Raji: An Ancient Epic,Nintendo Switch,"Fantasy Violence,Suggestive Themes",No Interactive Elements,No Rating Summary
210,Vegas Party,"PlayStation 4, Nintendo Switch",Simulated Gambling,No Interactive Elements,No Rating Summary
211,Serious Sam: Siberian Mayhem,PlayStation 5,"Blood and Gore,Intense Violence,Strong Language,Suggestive Themes",No Interactive Elements,"This is a first-person shooter in which players assume the role of Serious Sam as he battles alien forces in Siberia. Players use machine guns, shotguns, and rocket launchers to kill alien creatures and mutated humans in frenetic combat. Combat is accompanied by realistic gunfire, large explosions, and screams of pain. Large blood-splatter effects frequently appear as enemies are shot and killed. Some weapon attacks cause enemies to explode into large chunks of flesh that remain on the battlefield. One female creature is depicted with exposed breasts covered with pasties. The words “f**k” and “sh*t” are heard in the game."
