,Game,Platform,Content_Descriptor,Interactive_Elements,Ratings_Summary
0,Horse Tales: Emerald Valley Ranch,"PlayStation 4, PlayStation 5, Nintendo Switch",No Descriptors,No Interactive Elements,"This is an adventure/management game in which players can customize their stable while exploring an island and taking care of horses. Players can tame, breed, and train horses, as well as compete in obstacle races."
1,Airborne Kingdom,"PlayStation 4, Nintendo Switch",No Descriptors,No Interactive Elements,No Rating Summary
2,DARQ Ultimate Edition,"PlayStation 4, PlayStation 5, Nintendo Switch, Xbox One, Xbox Series","Mild Blood,Mild Language,Use of Tobacco,Violence",No Interactive Elements,"This is a puzzle platformer in which players assume the role of a boy trying to escape a lucid dream. From a 2D perspective, players traverse black-and-white, nightmarish levels while solving puzzles and avoiding creatures. Monsters will often attack players—slamming and/or pouncing on them; firing flintlock pistols to kill players. The game contains a comic book with sequences that depict additional violence and blood: a boy lying in a pool of blood after falling from a tower; blood underneath bodies flung from a train; a child with a bloodied face. A handful of comic-book panels depict characters smoking cigarettes. The word “bastard” appears in the game."
3,The Outbound Ghost,"PlayStation 4, PlayStation 5, Nintendo Switch",Fantasy Violence,No Interactive Elements,"This is an adventure role-playing game in which players help a village of ghosts while trying to regain their character's memories. From a sideways perspective, players explore environments, interact with ghosts, and battle hostile apparitions. Combat is turn-based, as players select attack moves/skills from a menu and view characters performing actions in short animations. Battles include impact sounds, screen-shaking effects, and dwindling hit points. The dialogue/game text makes several references to a “serial killer” that has wiped out the town's inhabitants."
4,Apico,"PlayStation 4, PlayStation 5, Nintendo Switch",No Descriptors,No Interactive Elements,No Rating Summary
5,SIFU,Nintendo Switch,"Blood,Drug Reference,Strong Language,Violence",No Interactive Elements,"This is an action game in which players assume the role of a martial artist on a quest for vengeance against a gang. As players infiltrate the gang's hideout, they use punches and kicks to defeat gang members in frenetic melee-style combat. Players can pick up various objects (e.g., pipes, bottles, baseball bats) to use as weapons against enemies. Combat is highlighted by cries of pain, impact sounds, and close-up camera angles of finishing blows. Enemies sometimes emit splashes of blood when hit, leaving small blood stains on the ground. One cutscene depicts a character stabbed with a knife and bleeding out. In a hideout level, players can encounter a drug called Purple Mist, which is depicted as a mound of purple powder and cut lines; text and dialogue also reference drugs (e.g., “The drug produced here”; “Junkies. I don't think they'll be a problem.)."
6,Sonic Frontiers,"Windows PC, PlayStation 4, PlayStation 5, Nintendo Switch, Xbox One, Xbox Series",Fantasy Violence,No Interactive Elements,"This is an action platformer in which players follow Sonic and his friends as they battle mechanical Titans. From an overhead perspective, players zoom through an alternate dimension while collecting items (e.g., rings, power-ups) and battling enemies (e.g., bouncing on them). Boss battles prompt players to climb giant robots while targeting weak spots and engaging in timed button presses for specific actions (e.g., energizing a punch, prying a robot's jaw open, pushing back against a giant sword). Some sequences depict slow-motion effects and explosions."
7,Romancing SaGa -Minstrel Song- Remastered,Windows PC,"Fantasy Violence,Mild Blood,Partial Nudity",No Interactive Elements,"This is a role-playing game in which players follow eight storylines surrounding a group of fighters battling monsters in a fantastical world. As players explore various environments interacting with characters, they can engage in turn-based battles using melee attacks, weapons (e.g., swords, spears), and magical attacks to deplete enemies' health bars. After selecting attacks/spells/actions from a menu, characters are depicted briefly striking enemy creatures (e.g., zombies, demons, monsters). Gallery images sometimes contain bloodstains and occasional depictions of breasts with minimal coverage."
8,Valis: The Fantasm Soldier Collection II,Nintendo Switch,"Fantasy Violence,Mild Blood,Suggestive Themes",No Interactive Elements,"This is a collection of three side-scrolling action/platformer games in which players control warriors as they battle monsters and demons. Players use swords and magic to defeat enemies, some of whom use boomerangs, blades, and fiery attacks. Cutscenes depict further instances of violence and occasional blood: two characters slashed, resulting in small blood-splatter effects; a character impaled by a spear, with blood around the wound. Some female characters are designed in a suggestive manner (e.g., deep cleavage, bikini tops; small harpies and demons that appear nude, though with no discernible detail); character profiles sometimes reference characters' body parts (e.g., “Her classmates tell her she has a bigger bust than most of them”; “She thinks her butt is her worst feature, so she rarely wears jeans”)."
9,Anno : Mutationem,"PlayStation 4, PlayStation 5, Nintendo Switch","Blood,Language,Suggestive Themes,Use of Alcohol and Tobacco,Violence",No Interactive Elements,"This is an action-adventure game in which players assume the role of a private investigator (Ann) on a quest to find her missing brother. From a 2D side view, players explore futuristic city environments, interact with characters, perform quests/tasks, and battle enemies in melee-style combat. Players use swords and explosives to defeat enemies (e.g., thugs, dragons, androids). Battles are frenetic at times, highlighted by explosions and cries of pain. Additional depictions of violence and blood include a body hanging by a noose; a blood-stained corpse; and bloodstained floors. A night club depicts female dancers with jiggling breasts; one character in the club can proposition Ann (e.g., “What? You got no money? Well, if you could accompany me to my residence…”). Some characters are seen smoking cigarettes, and a mini-game set in a bar depicts patrons consuming alcoholic drinks created by players' character. The word “a*shole” appears in the game."
10,Senren*Banka,Nintendo Switch,"Mild Violence,Partial Nudity,Sexual Themes,Strong Language",No Interactive Elements,No Rating Summary
11,Medieval Dynasty,"PlayStation 5, Xbox Series","Blood,Mild Language,Suggestive Themes,Use of Alcohol,Violence",No Interactive Elements,No Rating Summary
12,They Always Run,"PlayStation 4, Nintendo Switch","Blood,Strong Language,Violence",No Interactive Elements,"This is an action platformer in which players assume the role a bounty hunter (Aiden) on missions to capture criminals across the galaxy. Players traverse 2D platform levels while using punches, kicks, swords, and pistols to battle enemies in melee-style combat. Battles are often frenetic, highlighted by sword slashes and close-up slow-motion effects. Blood-splatter effects are frequently depicted as enemies are hit and killed. One sequence depicts a bound character shot in the head at close range. The words “f**k” and “sh*t” appear in the game."
13,Windstorm: An Unexpected Arrival,"PlayStation 4, Nintendo Switch","Mild Language,Mild Violence",No Interactive Elements,"This is an adventure game in which players follow a teenager working on a horse ranch. Players care for horses, learn about the mysteries and challenges of the ranch, and encounter some scenes of mild violence and peril: a character punching a man off screen; a woman fleeing from a large fire; a character shooting arrows at a villain's car tires, causing the vehicle to crash. The words “damn” and “hell” appear in the game."
14,New Joe & Mac: Caveman Ninja,"PlayStation 4, PlayStation 5, Nintendo Switch","Fantasy Violence,Mild Blood,Mild Suggestive Themes",No Interactive Elements,"This is an action platformer in which players assume the roles of cavemen Joe and Mac as they try to rescue their village's women from Neanderthals. From a sideways perspective, players traverse whimsical environments while using elemental attacks (e.g., fire) and weapons (e.g., rocks, boomerangs, fangs) to defeat enemies (e.g., Neanderthals, dinosaurs). Fire and electrical attacks result in cartoonishly charred enemies; enemies also react to damage with bugged-out eyes and exaggerated features. One stage depicts dinosaur skeletons with flesh and mild bloodstains on the bones. The game includes some mildly suggestive content: men dragging women by the hair; men with their tongues hanging out ogling women in revealing outfits (e.g., short skirts, halter tops); women in bikinis kissing players' character on the cheek."
15,The Chant,"Windows PC, PlayStation 5, Xbox Series","Blood and Gore,Strong Language,Use of Drugs,Violence",No Interactive Elements,"This is a horror/action-adventure game in which players assume the role of a woman (Jess) trying to survive and uncover the secrets behind a strange island. From a third-person perspective, players explore the island, search for survivors, and battle various enemies (e.g., mutated creatures, plant monsters, infected cultists). Players use holistic weapons (e.g., salt, sage sticks, fire oil) and spiritual powers (e.g., repel, crystallize, swarm) to defeat enemy creatures in melee-style combat. Combat is accompanied by cries of pain, impact sounds, and frequent blood-splatter effects. Defeat/death animations include players' character impaled on objects (e.g., a spike, a creature's horns), and getting her eye gouged out by a monster. Some areas depict large blood stains amid flayed bodies, and animals with exposed entrails. During the course of the game, players' character can consume tea laced with psychedelic mushrooms, resulting in hallucination effects on screen. The words “f**k” and “sh*t” are heard in the game."
16,Mato Anomalies,"Windows PC, PlayStation 4, PlayStation 5, Nintendo Switch, Xbox One, Xbox Series","Drug Reference,Fantasy Violence,Language,Mild Blood,Mild Suggestive Themes,Use of Alcohol and Tobacco",No Interactive Elements,"This is a role-playing game in which players lead heroes on a quest to defeat mythical creatures. Players explore city environments, interact with characters, solve puzzles, and battle monsters in turn-based combat. Players select attack moves from a menu and watch characters perform actions in short animated sequences. Players use swords, pistols, shotguns, and magic to defeat enemy creatures. Battles are highlighted by impact sounds and screen-shaking effects. A handful of still-images depict splatters of blood on the screen and on characters' clothing. Some female characters are designed with revealing costumes (e.g., low-cut outfits, deep cleavage); one character refers to another as a ""whore."" The game depicts characters consuming alcohol and getting drunk (e.g., flushed faces, slurred speech); one sequence depicts a man smoking a cigar. A fantasy drug, a plant causing hallucinations, is often described in the game, along with other drug references: “Creating addicts to then become…their best customers? That's a pretty sweet trade racket”; “This is one weird trip”; “I made a powder...and I swear It's still a pretty good buzz”; “The hallucinogenic stuff…”; ""What kind of drugs are you taking?"" The word “sh*t” appears in the game."
17,My Universe - My Baby Dragon,Nintendo Switch,No Descriptors,No Interactive Elements,"This is a pet simulation game in which players raise and care for a baby dragon. Players can feed and interact with the dragon while engaging in training activities (e.g., flying lessons, magic training)."
18,Oddworld Soulstorm,Nintendo Switch,"Blood and Gore,Language,Use of Tobacco,Violence",No Interactive Elements,"This is an adventure-platformer in which players assume the role of a character trying to save his people from an evil force. From a mostly side-scrolling perspective (i.e., 2.9D), players traverse platform environments, solve puzzles, and engage in various combat tasks (e.g., mind-controlling guards to shoot at one another, using characters to attack enemies). Enemy guards use missiles and machine guns to attack players and unarmed characters attempting to flee. Combat is highlighted by cries of pain, gunfire, and explosions; missiles sometimes cause enemies to explode into jibs or small chunks of flesh. A handful of cutscenes depict characters with bloody gunshot wounds. During the course of the game, a character is frequently depicted smoking a cigar. The word “sh*t” appears in the dialogue."
19,Resident Evil 4,Meta Quest 2,"Blood and Gore,Intense Violence,Language",No Interactive Elements,"This is a VR action-horror action game in which players assume the role of a man (Leon Kennedy) attempting to rescue a character from a mysterious cult. From a first-person perspective, players use pistols, rifles, shotguns, and machine guns to kill infected humans and mutant creatures. Some attacks result in decapitation, accompanied by large blood-splatter effects; several levels depict large bloodstains and/or impaled bodies. Cutscenes depict further instances of intense violence: a character decapitated by a chainsaw; a man impaled through the chest; a character's face burning from acidic fluids. The word “sh*t” appears in the dialogue."
20,Song in the Smoke,PlayStation 4,"Blood and Gore,Violence",No Interactive Elements,"This is a survival/adventure game in which players make their way through several wilderness environments collecting resources, hunting, and crafting tools/weapons/potions. From a first-person perspective, players use spears, arrows, and axes to attack deer, boar, lions, lizards, and other animals. Animals scratch and bite the player, eventually resulting in blood pooling across the screen when the player is killed. Players can butcher animal carcasses to obtain pelts, bones, and meat as well as “raw gut,” which is briefly depicted as a handful of entrails in the player's hand. Small splatters of blood also appear during butchering sequences."
21,Triangle Strategy,Windows PC,"Blood,Fantasy Violence,Language,Mild Suggestive Themes,Use of Alcohol",No Interactive Elements,"This is a role-playing adventure game in which players follow the story of a nobleman whose kingdom is on the brink of war. As players progress through the narrative, they can interact with characters to gain allies, make dialogue choices, and engage in tactical turn-based combat. Presented from a 3/4-overhead perspective, players position characters on a grid-based area, using weapon strikes and magic to defeat enemy forces. Battles are accompanied by cries of pain, impact sounds, and screen-shaking effects. Cutscenes depict additional acts of violence and blood: a character with a pool of blood underneath his body; a character killed by an arrow; a character executed off-screen. Some female characters are designed in outfits with moderate amounts of cleavage; the dialogue contains some suggestive innuendo (e.g., “You really must use your head more often. The one atop of your shoulders, that is""; “You seem like an honest man. I will thoroughly enjoy laying you down….hahaha.”). The game contains some references to wine, ale, and getting ""tipsy"" in dialogue; a drunk character is depicted slurring his speech, hiccupping, then passing out. The word “sh*te” is heard in the game."
22,Kukoos: Lost Pets,"PlayStation 4, Nintendo Switch",Mild Fantasy Violence,No Interactive Elements,"This is an adventure platformer in which players control oceanic characters through various worlds. From sideways and overhead perspectives, players traverse whimsical platforms and use power-ups to defeat enemy pets that emit cries of pain and disappear into puffs of smoke when struck/jumped on. Boss battles depict more protracted violence (e.g., shooting a giant crab with a cannon; deflecting large bullets fired from a cartoony machine-gun turret)."
23,Operation Wolf Returns: First Mission,"PlayStation 4, PlayStation 5, Nintendo Switch","Blood,Mild Suggestive Themes,Use of Tobacco,Violence",No Interactive Elements,"This is an arcade-style first-person shooter in which players engage in combat missions to disband a criminal network. While infiltrating enemy bases, players use pistols, machine guns, and grenade launchers to destroy vehicles and kill enemy soldiers. Firefights can be frenetic, highlighted by realistic gunfire, cries of pain, and large explosions. Enemies emit brief splashes of blood when hit. As players make their way through each level, they must avoid shooting civilians including a running woman with jiggling breasts. The game often depicts a sergeant holding and/or smoking a cigar."
24,RWBY: Arrowfell,"PlayStation 4, PlayStation 5, Nintendo Switch, Xbox One, Xbox Series",Fantasy Violence,No Interactive Elements,"This is an action platformer in which players control warriors that battle various enemies while progressing through a storyline. Players traverse platforms, solve puzzles, interact with characters, and battle small enemies (e.g., robots, cyborgs, human figures). Characters use swords and futuristic blasters to defeat enemies; combat is highlighted by fantastical gunfire, impact sounds, and brief explosions."
25,The Eternal Castle [Remastered],PlayStation 4,"Mild Blood,Strong Language,Violence",No Interactive Elements,No Rating Summary
26,Vampire the Masquerade - Coteries of New York,"PlayStation 4, Nintendo Switch","Blood,Mild Violence,Sexual Themes,Strong Language",No Interactive Elements,"This is a visual novel in which players navigate a conflict between vampiric factions in New York. As players follow the storyline, they make dialogue/action choices that can influence the plot; cutscene text can describe violent acts in detail (e.g., “His lifeless body crumples to the ground and begins to decompose in real time”; “You hear the shears click. . .[her] red hair conceals her face as her head falls, separated from the shoulders”). One still image depicts a bedroom with two corpses lying in pools of blood. Sexual material appears in the text/dialogue (e.g., “On top of the bedsheets, you notice what seems to be...pieces of elaborate S&M equipment""; “...feeling up a sex worker at a nightclub;” “[F]un fact about being a vampire...Some of us can even orgasm”; “This is not a sex show?”). The words “f**k,” “c*nt,” and “sh*t” appear in the game."
27,Vampire the Masquerade - Shadows of New York,"PlayStation 4, Nintendo Switch","Blood,Drug Reference,Mild Violence,Sexual Themes,Strong Language",No Interactive Elements,"This is a visual novel in which players assume the role of a vampire investigating a murder while navigating conflicts between New York's clans. As players follow the storyline, they make dialogue/action choices to affect the plot. One interrogation scene gives players the option to “do whatever is necessary”; the torture sequence is described in text (no actions depicted). Another scene depicts the aftermath of a gunfight, with corpses lying in pools of blood. The game references sexual material (e.g., “[He's] a... sexual predator...”; “...some weird psychosexual stuff with her brother”; “You just told me your bosses are having Eyes Wide Shut parties, and suddenly you don't believe in rich people's pedophile rings?”). The game includes brief drug content: references to Ketamine and MDMA; dialogue such as “Maybe this one time, the high won't end”; ""I have to replenish my stash""; ""No drugs tonight""; “What are you, a junkie?”). The words “f**k,” “c*nt,” and “sh*t” appear in the game."
28,Stranded: Alien Dawn,Windows PC,"Blood,Fantasy Violence,Mild Suggestive Themes,Use of Alcohol and Tobacco",No Interactive Elements,"This is a survival strategy game in which players manage the fate of survivors from a crashed-landed space cruise. From a top-down perspective, players explore an alien world, direct survivors to scavenge/gather resources, engage in expeditions, and occasionally battle hostile aliens. Characters use arrows, guns, and machine-gun turrets to kill attacking aliens or hunt animals for food. Some creatures emit splatters of blood when injured; human characters are also depicted with splatters of blood when wounded or attacked. Players have the option to harvest human meat from corpses for survival (though the game does not encourage players to do so). The game contains some mildly suggestive material: non-specific references to characters flirting and telling suggestive/inappropriate jokes; a character bio that reads, “Yokko was a highly sought-after escort…”; players' ability to remove characters' clothing (down to their underwear) and place them in bed together. Characters can distill moonshine and consume alcohol (e.g., wine, ale); survivors that drink too much alcohol can become drunk and vomit. Players can also grow tobacco-like crops that can later be smoked by survivors."
29,Octopath Traveler II,"Windows PC, PlayStation 4, PlayStation 5, Nintendo Switch","Fantasy Violence,Mild Blood,Mild Language,Suggestive Themes,Use of Alcohol and Tobacco",No Interactive Elements,"This is a role-playing game in which players follow the stories of eight characters in a fantasy world. From a top-down perspective, players explore towns while interacting with figures and battling enemies (e.g., monsters, human villains). Combat is turn-based, with players selecting attack moves from a menu then watch characters perform brief actions on screen. Characters use spears, swords, and elemental attacks to deplete opponents' health bars; battles are highlighted by impact sounds and cries of pain. Cutscenes sometimes depict small defenseless characters killed by bladed weapons. Swords or bags are sometimes depicted with blood stains. The game contains some suggestive material: a female character designed with low-cut clothing and deep cleavage; dialogue such as ""...another brothel girl...[H]ow about entertaining us instead? I'm sure you'll find us more satisfying than the lord himself”; “After you downed three full glasses of wine, you and I got up to all sorts of naughty hijinks”; “Why don't you come have some fun with us?...[W]e were told we could have our way with you…”). Characters are sometimes depicted drinking liquor and/or hiccupping and drunk; one scene depicts a character smoking a cigarette. The words “p*ssed” and “bastard” appear in the game."
30,Super Perils of Baking,PlayStation 4,"Alcohol Reference,Mild Fantasy Violence,Mild Language",No Interactive Elements,No Rating Summary
31,SEGA Genesis Mini 2,Plug-and-Play,"Blood and Gore,Mild Suggestive Themes,Violence",No Interactive Elements,"This is a collection of classic Sega Genesis games from the 80s and 90s. Games include action/adventure titles in which players can attack realistic and fantastical enemies by using axes, swords, guns, and other melee weapons. One side-scrolling game depicts blood-splattered rooms and enemies that burst into splatters of blood and viscera when killed. Other games depict one-on-one fighting, with characters punching and kicking each other in attempts to drain opponents' health meters. A handful of games depict female characters in revealing outfits (e.g., low-cut/bra-like tops, deep cleavage)."
32,Green Lava Studios Volume 2,PlayStation 4,"Sexual Themes,Use of Drugs",No Interactive Elements,No Rating Summary
33,Paradigm Paradox,Nintendo Switch,"Blood,Fantasy Violence,Mild Language",No Interactive Elements,"This is a visual novel in which players follow a high-school girl navigating a world filled with monsters and superheroes. As players read through text (accompanied by voices and pictures), they can encounter some still-screen images that depict battles between characters and monsters (Vectors); combat sounds include cries of pain, gunfire, and explosions. A handful of still images depict blood: characters' faces or clothing splattered with blood; corpses lying in pools/splatters of blood. The words “a*s” and “p*sses me off” appear in the game."
