,Game,Platform,Content_Descriptor,Interactive_Elements,Ratings_Summary
120,The Valiant,Windows PC,"Blood,Language,Violence",No Interactive Elements,"This is a strategy game in which players follow the story of Theoderich von Akenburg, a former Templar knight battling enemy forces while on a quest to find a mysterious relic. From a top-down perspective, players move their military units through battlefields using swordsmen, spearmen, cavalry, and archers to kill enemy troops. Battles are highlighted by cries of pain, impact sounds, and blood-splatter effects. Corpses remain on the battlefield in pools of blood. Some cutscenes contain closer views of this content or characters being impaled by swords; one cutscene depicts a man being shot in the eye with an arrow. The word “sh*te” appears in the game."
121,The Callisto Protocol,"Windows PC, PlayStation 4, PlayStation 5, Xbox One, Xbox Series","Blood and Gore,Intense Violence,Strong Language",No Interactive Elements,"This is a third-person shooter/survival horror game in which players assume the role of a prisoner (Jacob Lee) battling for survival in a prison on a distant moon in the future. Players explore prison and planet/moon locations; scavenge for clues, gear, and weapons; and battle mutated creatures in frenetic combat. Players use guns and a gravity tool, and engage in melee fighting (e.g., punching, stomping, using pipes as weapons) to defeat enemies. Some sequences depict Jacob killed in dramatic fashion: cut in half by giant fan blades; head repeatedly smashed into the ground; arms cut off; face sheared off. Blood-splatter effects occur during combat, and some attacks cause dismemberment or decapitation. Somel scenes depict disemboweled/mutilated human corpses, with missing heads and limbs. The words “f**k” and “sh*t” appear in the game."
122,Arkanoid - Eternal Battle,"PlayStation 4, PlayStation 5, Nintendo Switch, Xbox One, Xbox Series",Mild Fantasy Violence,No Interactive Elements,"This is a collection of classic puzzle/brick breaker games in which players bounce a ball into bricks and shapes to clear game boards. One game depicts a giant face, whose health meter must be depleted; the boss character makes grunting/groaning sounds of pain when hit by the player's ball."
123,Miraculous: Rise of the Sphinx,"Windows PC, PlayStation 4, PlayStation 5, Nintendo Switch, Xbox One, Xbox Series",Fantasy Violence,No Interactive Elements,"This is an action platformer in which players assume the roles of two high-school students trying to save the people of Paris from a supervillain. From a third-person perspective, players traverse environments (e.g., city streets, rooftops, tunnels), interact with characters, and battle enemies in melee-style, close-quartered combat. Players use batons and yo-yo strikes to defeat cartoony enemies (e.g., robots, minions, mummies); fights are accompanied by impact sounds, screen-shaking effects, and cries of pain. Enemies generally disappear amid puffs of smoke and sparks."
124,Cult of the Lamb,"PlayStation 4, PlayStation 5, Nintendo Switch","Blood,Fantasy Violence",No Interactive Elements,"This is an action-adventure game in which players assume the role of a possessed lamb brought back to life to create a cult following. Players traverse cartoony environments, attempt to rescue lost lambs, and use axes and daggers to battle enemy creatures (e.g., demons, evil monks, bats). Battles are highlighted by sword slashes, cries of pain, and screen-shaking effects. Enemies generally turn into skeletons and/or leave black stains when killed. Some environments depict impaled creatures on bloody spikes and blood stains on altars."
125,PAW Patrol Grand Prix ,"Windows PC, PlayStation 4, PlayStation 5, Stadia, Nintendo Switch, Xbox One, Xbox Series",No Descriptors,No Interactive Elements,"This is a kart-racing game in which players race with characters from the Paw Patrol TV show. As players race across various tracks, they can collect doggie biscuits and cartoony power-ups (e.g., pies, tornado shield, speed boosts) to help slow down opponents and win races."
126,Way of the Hunter,"Windows PC, PlayStation 5, Xbox Series","Blood,Language,Violence",No Interactive Elements,"This is a first-person hunting-simulation game in which players hunt for animals in the USA and Europe. Players can explore open-world environments while using realistic rifles to shoot and kill game (e.g., deer, birds, wolves, bears). Hunting is accompanied by realistic gunfire and blood-splatter, and blood stains on the ground. Scan-like images of bullet trajectories depict animals' bones/internal organs when shot. The word “sh*t” appears in the dialogue."
127,Demons of Asteborg,Nintendo Switch,"Blood and Gore,Fantasy Violence",No Interactive Elements,No Rating Summary
128,SteelRising,"Windows PC, PlayStation 5, Xbox Series","Blood,Violence",No Interactive Elements,"This is an action role-playing game in which players assume the role of Aegis, an automaton battling robot armies during the French Revolution. Players explore ruined revolution-era cities while fighting fantastical automatons in melee combat. Players use grenades, swords, lances, and bladed fans to deplete enemies' health bars. Battles are highlighted by impact sounds, explosions, and cries of pain. One sequence depicts a human character executed by guillotine--the camera pans away before the blade falls. Several locations depict large blood stains and piles of human corpses lying in pools of blood."
129,Within the Blade,PlayStation 4,"Blood and Gore,Violence",No Interactive Elements,No Rating Summary
130,Who Pressed Mute on Uncle Marcus?,PlayStation 4,"Drug Reference,Mild Blood,Strong Language,Violence",No Interactive Elements,No Rating Summary
131,Snowtopia,Stadia,No Descriptors,No Interactive Elements,"This is a simulation game in which players build and manage a ski resort. Players can build facilities, create new ski slopes, and improve the reputation of the resort."
132,Kombinera,"PlayStation 4, PlayStation 5",No Descriptors,No Interactive Elements,No Rating Summary
133,Bill and Ted's Excellent Retro Collection,"PlayStation 4, PlayStation 5, Nintendo Switch",Mild Fantasy Violence,No Interactive Elements,"This is a collection of two arcade-style adventure games, in which players help Bill and Ted search for stranded historical figures. Players interact with 2D sprite-like figures, collect/search for items, and avoid hazards (e.g., torches) and pixelated enemies, one of whom can shoot players with a pistol. Damage is usually indicated by characters blinking and/or falling off screen."
134,Mind Scanners,Nintendo Switch,"Drug Reference,Strong Language,Suggestive Themes",No Interactive Elements,No Rating Summary
135,Exit the Gungeon,"PlayStation 4, Nintendo Switch","Fantasy Violence,Mild Language,Use of Tobacco",No Interactive Elements,No Rating Summary
136,Made in Abyss: Binary Star Falling into Darkness,"PlayStation 4, Nintendo Switch","Blood and Gore,Violence",No Interactive Elements,"This is an action role-playing game, based on a manga/anime, in which players follow the story of children exploring a strange abyss filled with monsters. From a third-person perspective, players collect resources, explore landscapes, interact with characters, and battle monsters in melee combat. Death scenes can be dramatic, as child-like characters are seen impaled on spikes, disemboweled, covered in blood, and eaten by monsters. One cutscene briefly depicts a young character removing her eyeballs. Characters sometimes emit large splatters of blood, before falling to the ground; some deaths are briefly depicted in first-person, with blood splattering the camera."
137,Tempest 4000,Nintendo Switch,Mild Fantasy Violence,No Interactive Elements,No Rating Summary
138,Black Widow - Recharged,"PlayStation 4, PlayStation 5, Nintendo Switch",Mild Fantasy Violence,No Interactive Elements,No Rating Summary
139,Asteroids: Recharged,"PlayStation 4, PlayStation 5, Nintendo Switch",Mild Fantasy Violence,No Interactive Elements,No Rating Summary
140,Centipede: Recharged,"PlayStation 4, PlayStation 5, Nintendo Switch",Mild Fantasy Violence,No Interactive Elements,No Rating Summary
141,Airoheart,"PlayStation 4, PlayStation 5, Nintendo Switch, Xbox One, Xbox Series","Fantasy Violence,Mild Blood",No Interactive Elements,"This is an action-adventure game in which players assume the role of an adventurer on a quest to save a fantasy kingdom. From a top-down perspective, players explore dungeons and forests, solve puzzles, and use weapons (e.g., swords, bombs) to defeat stylized, 16-bit enemies (e.g., small zombies, cyclops, skeletons). Battles are accompanied by sword slashing, cries of pain, and mild explosions; enemies generally disappear amid puffs of smoke when defeated. In one sequence, a small blood trail is shown leading to a wounded character."
142,Panzer Dragoon: Remake,Nintendo Switch,"Animated Blood,Fantasy Violence",No Interactive Elements,"This is a third-person shooter in which players assume the role of a dragon-riding fighter battling an evil empire in a post-apocalyptic world. Players ride a dragon and follow “on rails” paths through each level. Combat can be frenetic, with players shooting enemy airships and creatures, resulting in explosions and/or enemies bursting apart. Boss battles depict more protracted combat, with frequent missile and gunfire sound effects. One cutscene depicts a crushed scorpion-like creature in a pool of purple blood."
143,Piofiore: Episodio 1926,Nintendo Switch,"Blood,Drug Reference,Strong Language,Violence",No Interactive Elements,"This is a visual novel in which players assume the role of a woman navigating mafia organizations in 1920s Italy. As players progress through the story, they can make choices that impact the narrative. Some choices lead to instances of violence, depicted in still-screen sequences: a character stabbed (off-screen); two men exchanging gunfire; a character shot to death (off-screen). Blood effects sometimes are depicted, mostly as splatters/smears on screen. The game contains references to drugs/drug deals, specifically heroin. The words “f**k” and “sh*t” appear in the game."
144,Tactics Ogre: Reborn,"Windows PC, PlayStation 4, PlayStation 5, Nintendo Switch","Fantasy Violence,Mild Blood,Mild Language,Mild Suggestive Themes",No Interactive Elements,"This is a role-playing game in which players assume the role of a knight caught between warring factions in a fictional world. From a 3/4-overhead perspective, players take turns selecting attack moves/skills from a menu to defeat enemies on grid-like battlefields. Characters use swords, guns, and magic spells to attack enemies; battles are highlighted by impact sounds and grunts of pain. Cutscenes depict further instances of violence: characters stabbing themselves; knights slashing civilians; a bound man whipped for information. One cutscene depicts small bloodstains on a knife after a stabbing; some character portraits also depict bloodstained faces. Some female characters are designed with revealing outfits (e.g., deep cleavage); the dialogue references suggestive material (e.g., “Elders beaten, women...defiled”; “She's yours. Enjoy the spoils of war”; “We'll put her to good use, won't we boys?”). The words “b*tch,” “a*se,” and “bastard” appear in dialogue."
145,XIII,PlayStation 5,"Blood,Strong Language,Violence",No Interactive Elements,"This is a first-person shooter, based on the comic XIII, in which players assume the role of an amnesiac running from assassins and the FBI. Players use various weapons (e.g., pistols, shotguns, machine guns, knives) and melee attacks/punches to attack and kill enemies. Combat is highlighted by gunfire, cries of pain, and blood-splatter effects; corpses can be seen lying in pools of blood during some sequences. Although the game is depicted in a stylized, cell-shaded art style, some attacks are highlighted by comic panels that focus on the kills (e.g., a successful knife throw to an enemy's head). The words “f**k” and “sh*t” appear in the dialogue."
146,PONG Quest,PlayStation 4,No Descriptors,No Interactive Elements,No Rating Summary
147,Breakout: Recharged,"PlayStation 4, PlayStation 5, Nintendo Switch",No Descriptors,No Interactive Elements,No Rating Summary
148,Five Nights at Freddy's: Security Breach,"Xbox One, Xbox Series",Fantasy Violence,No Interactive Elements,"This is an exploration/horror game in which players assume the role of a young boy (Gregory) trapped overnight in an entertainment center filled with robotic staff and animatronic animals. From a first-person perspective, players explore the dark complex while solving puzzles and using stealth to avoid getting caught. Characters mostly grab Gregory and scream whenever players fail to stay hidden, though some actions result in violence: robots repeatedly beating the targeted character; animatronics struck by bumper cars; a character crushed inside a trash compactor. The game contains frequent screams and jump scares, as players are attacked without warning."
149,Super Bullet Break,"Windows PC, PlayStation 4, PlayStation 5, Nintendo Switch","Fantasy Violence,Mild Language,Suggestive Themes",No Interactive Elements,"This is a strategy/deckbuilder game in which players help characters hack an online video game to battle a rouge AI. Players battle the AI system in turn-based combat using collectible character cards known as Bullets. Each character card/bullet is associated with attack/defense points and are used (with targeting crosshair) to defeat human characters and fantastical creatures (e.g., robots, bugs, demons). Battles are highlighted by impact sounds, bursts of light, and cries of pain. Some character cards depict female characters wearing revealing outfits (e.g., deep cleavage, partially exposed buttocks) in suggestive poses (e.g., straddling wands, bent over, reclined with legs in the air). The word “a*s” appears in the game."
150,New Tales from the Borderlands,"Windows PC, PlayStation 4, PlayStation 5, Nintendo Switch, Xbox One, Xbox Series","Blood and Gore,Intense Violence,Partial Nudity,Sexual Themes,Strong Language,Use of Alcohol",No Interactive Elements,"This is a narrative-driven adventure game in which players follow the story of characters on a quest to harness the power of a crystal. As players progress through the story, they can perform action choices by following onscreen prompts. Some choices lead to intense acts of violence: a close-up of a woman stabbed in the neck; a man shot through the chest; a character stabbed in the eye—blood-splatter effects accompany these sequences. A handful of scenes depict decapitated corpses, dismembered limbs, and exposed organs. The game contains some references to sexual material in the dialogue (e.g., “I'm riddled with STDs”; “May Heaven be one big orgy""; ""...all they want to do is fornicate...""; ""You said 'that ain't good' and I said 'title of our sex tape.' Because we'd have sex.""). Some female characters appear partially nude, with close-up depictions of exposed breasts and buttocks, though with no discernible details (i.e., no nipples). During the course of the game, players' character can use a funnel contraption (Booze Luge) to repeatedly consume champagne. The words “f**k” and “sh*t” are heard in the game."
151,Prinny Presents NIS Classics Volume 3: La Pucelle: Ragnarok / Rhapsody: A Musical Adventure,Nintendo Switch,"Blood,Fantasy Violence,Mild Language,Suggestive Themes,Use of Tobacco",No Interactive Elements,"This is a compilation of two strategy role-playing games in which players follow the story of demon hunters trying to save characters in a fantasy world. From a 3/4-overhead perspective, players engage in turn-based combat against fantastical creatures (e.g., demons, zombies, cat people) on grid-based battlefields. Players choose weapon and magic attacks from a menu to battle enemies. A handful of sequences depict additional acts of violence and/or blood: a character in silhouette impaled by spears; a crucified woman impaled by spears, causing blood to pool underneath her; a message written in blood on a wall. The games contain references to suggestive material in the dialogue (e.g., “…[She] got big hooters. But I didn't know she had owls”; “Master Myoa's flat-chested”; “Get away from me, you pervert.”). Some female characters are designed with revealing outfits (e.g., deep cleavage) and jiggling breasts. A handful of monsters are depicted topless, though with no discernible details (i.e., no nipples). One character is frequently shown lighting up and smoking a cigarette. The words “bastard” and “p*ss me off” appear in the game."
152,Victoria 3,"Macintosh, Windows PC","Mild Blood,Mild Suggestive Themes,Mild Violence,Partial Nudity,Use of Drugs",No Interactive Elements,"This is a strategy game in which players manage a Victorian-era nation to economic and social prosperity. Players develop their nation's economic growth, engage in politics, and make policy decisions on varied topics (e.g., slavery, treaties, warfare). When nations engage in warfare, a top-down view of bases/encampments firing upon each other is depicted on a map. Some political decisions reference violence in text (e.g., “… use of mustard gas against a civilian population…”; “An ardent abolitionist died in a fire fight with a pro slavery mob.”), with still images of characters shot and civilians beaten. One still image depicts a whale harpooned, with small splatters of blood. The game contains brief references to suggestive/sexual material (e.g., “Police have shut down a notorious male brothel”; “This character has caught Syphilis...""). Some female characters are depicted partially topless, with exposed nipples. One still-image shows a man smoking opium."
153,Dusk Diver 2,"PlayStation 4, PlayStation 5, Nintendo Switch","Fantasy Violence,Mild Language,Suggestive Themes",No Interactive Elements,"This is an action game in which players assume the role of a college student battling invading creatures from another dimension. Players explore city environments, interact with characters, complete quests, and battle fantastical creatures (e.g., robots, demons, cyber beasts) in melee-style combat. Players use punches, kicks, and a variety of weapons (e.g., scythes, chainsaws, pistols) to defeat enemies. Battles are frenetic, highlighted by impact sounds, colorful light effects, and cries of pain. Some characters are designed with revealing outfits (e.g., deep cleavage, partially exposed buttocks), and breasts that jiggle during combat and cutscenes. The words “a*s” and “bastard” appear in the dialogue."
154,Galactic Wars EX,PlayStation 4,Mild Fantasy Violence,No Interactive Elements,No Rating Summary
155,HYPER SENTINEL,Nintendo Switch,Mild Fantasy Violence,No Interactive Elements,No Rating Summary
156,Kirby's Dream Buffet,Nintendo Switch,Mild Cartoon Violence,No Interactive Elements,"This is a collection of minigames (e.g., party games) in which players assume the roles of Kirby characters as they compete to eat the most food. Players compete in various races and engage in a whimsical Battle Mode, slamming into small opponents and using power ups (e.g., needle, pepper) to knock cartoony characters off tracks/platforms. Kirby yelps when knocked out of bounds, and gets dizzy when hit with an item or hazard."
157,DEEEER Simulator: Your Average Everyday Deer Game,"PlayStation 4, Nintendo Switch",Violence,No Interactive Elements,No Rating Summary
158,Life is Strange 2 ,Stadia,"Blood,Partial Nudity,Sexual Content,Strong Language,Use of Drugs and Alcohol,Violence",No Interactive Elements,"This is an adventure game in which players follow the story of a teenager (Sean) and his younger brother as they run from police, search for their mother, and struggle to survive. As players explore environments, they can make dialogue and action choices that influence the outcome/progression of the story (e.g., whether to steal, lie, cause physical harm). Some cutscenes depict acts of violence: a man shot by a police officer; a man punching, kicking, and pistol-whipping a teenager; young characters getting shot (usually off-screen); humans and animals flung to their deaths. Blood sometimes appears on wounded or dead characters and animals. The game contains sexual material and instances of nudity: a woman with exposed breasts and buttocks; a woman straddling a man inside a tent; dialogue referencing sexuality (e.g., “We are just f**k buddies”; “We can be our true selves, nobody's telling me whose d*ck to suck…”). During the course of the game, a handful of sequences allow the player's character to smoke marijuana; the game also depicts underage drinking and smoking. The words “f**k” and “sh*t” are heard in the game."
159,Miss Kobayashi's Dragon Maid: Burst Forth!! Choro-gon ☆ Breath,"PlayStation 4, Nintendo Switch","Fantasy Violence,Partial Nudity",No Interactive Elements,"This is an action shooter in which players rotate control between three characters as they battle their way through levels in a computer. From a top-down perspective, players shoot and avoid waves of colorful projectiles flying around the screen; enemy creatures (e.g., goblins, skeletons, slimes) and bosses explode into fiery bursts when defeated. Some female characters are depicted with ripped clothing after being injured during gameplay; still images appear on screen, depicting characters with small scraps of fabric barely covering their breasts and/or pelvic region."
160,Eldest Souls,"PlayStation 4, PlayStation 5, Nintendo Switch","Blood,Fantasy Violence",No Interactive Elements,No Rating Summary
161,Captain ToonHead vs The Punks from Outer Space,PlayStation 4,"Fantasy Violence,Mild Language",No Interactive Elements,"This is a first-person shooter/tower-defense game in which players assume the role of a spaceship janitor trying to save Earth from evil forces. Players move between stationary positions as they build turrets and use fantasy weapons (blasters, flip-flops shooting projectiles, hammers emitting energy) to defeat energy-cube creatures. First-person combat can be frenetic at times, highlighted by laser gunfire, cries of pain, and large explosions. The words “a*s” and “bastard” appear in the game."
162,Teenage Mutant Ninja Turtles: Shredder's Revenge,"PlayStation 4, Nintendo Switch, Xbox One",Fantasy Violence,No Interactive Elements,"This is an action game in which players help the Teenage Mutant Ninja Turtles defeat the villain Shredder. Players traverse 2D side-scrolling levels and use punches, kicks, and cartoony weapons (e.g., swords, nunchucks, hockey sticks) to battle enemies (e.g., foot soldiers, robots, large boss characters). Combat is sometimes frenetic, highlighted by impact sounds, mild explosions, and screen-shaking effects."
163,Fallen Legion Revenants,"Windows PC, PlayStation 5, Xbox One, Xbox Series","Fantasy Violence,Mild Language",No Interactive Elements,"This is an action role-playing game in which players assume the roles of characters on a quest to stop an evil tyrant. Players traverse side-scrolling landscapes, interact with characters, and battle human and fantasy creatures (e.g., zombies, demons, phantoms) in turn-based combat. Characters use swords, crossbows, guns, and magic attacks to defeat enemies. Battles are accompanied by impact sounds, large explosions, and cries of pain. The game contains some dark thematic elements: references to child imprisonment and torture; dialogue choices pertaining to prisoner executions. The words “bastard” and “b*tch” appear in the dialogue."
164,Fallen Legion: Rise to Glory,"PlayStation 5, Xbox One, Xbox Series","Fantasy Violence,Language,Mild Blood,Mild Suggestive Themes",No Interactive Elements,"This is a collection of two role-playing games in which players control fighters trying to save a fictional empire. From a side-scrolling perspective, players move through landscapes, interact with characters, and battle human and fantastical creatures (e.g., dragons, goblins, lizard men). Characters use swords, axes, arrows, and magic attacks (e.g., fireballs) to defeat enemies. Battles are highlighted by cries of pain and brief explosions. A handful of still-images depict characters with streaks of blood on their faces and/or clothing. The game contains instances of suggestive material: a female character in a skin-tight body suit; a limerick with the line, “The princess would belong to him/And serve his needs in bed.” The words “a*s,” “bastard,” and “b*tch” appear in the dialogue."
165,Atari 50: The Anniversary Celebration,"Windows PC, PlayStation 4, PlayStation 5, Nintendo Switch, Xbox One, Xbox Series","Blood,Drug Reference,Fantasy Violence,Language,Mild Sexual Themes",No Interactive Elements,"This is a collection of classic Atari games from a variety of platforms (e.g., 2600, 5200, Atari 800). Some games allow players to engage in one-on-one fights using human-like characters to punch and kick each other as they attempt to deplete opponents' life meters (successful hits are accompanied by splashes of blood). Other games include space shooters, dungeon crawlers, and mining games with cartoony explosives used to defeat monsters. The collection includes artifacts and video interviews from key figures/moments in historical gaming eras: one interview references a pedophile in the context of a game (depicted as a small unclothed figure with a censor bar over his crotch); other interviews reference drug use (e.g., marijuana, cocaine, psilocybin). The word ""sh*t"" can be heard during interviews."
